"開始時間","結束時間","城市區域","行程類型","地點","詳細內容","交通方式","詳細交通","移動時間","餐飲購物建議","票券優惠","永續綠色旅遊","里山精神","備註"
"00:00","06:30","大阪心齋橋","住宿","心齋橋維亞酒店－JR 西日本集團","充足睡眠，為全天 USJ 體驗養精蓄銳","步行","飯店內","約0分鐘","無","無","無","以休息養足精力迎接高強度體驗日","建議06:00起床，準備早餐與出發"
"06:30","07:00","大阪心齋橋→USJ","交通","心齋橋站 → Universal City 站（日本環球影城）","搭乘 Osaka Metro 前往 JR 環狀線轉乘至 Universal City","Osaka Metro + JR 夢咲線","心齋橋站搭御堂筋線至梅田，轉 JR 環狀線至西九条，再轉 JR 夢咲線至 Universal City（全程約25分鐘）；或搭御堂筋線至難波轉 JR 大阪環狀線；Google Maps: Shinsaibashi Station to Universal City Station JR","約30分鐘","車上可吃便利商店早餐","ICOCA 搭乘","大眾運輸前往，避免開車","以輕便方式前往大型主題樂園，維持低碳移動","USJ 建議07:00前入場，提早出發搶先排隊"
"07:00","21:00","大阪此花區","體驗","日本環球影城（Universal Studios Japan）","全天暢玩 USJ，重點體驗超級任天堂世界、哈利波特魔法世界、小小兵等園區","步行","園區內步行；Google Maps: Universal Studios Japan Osaka","約0分鐘","園內餐飲選擇多樣，推薦黃油啤酒、小小兵爆米花桶；建議自備水瓶減少購買","USJ 1日券（或含豪華版關西樂享周遊券 USJ 項目）；超級任天堂世界 Area Pass 需整理券或 Express Pass，強烈建議事先購買","自備水瓶，減少一次性杯具使用；食物包裝盡量集中丟棄","即使在主題樂園也維持少廢棄的旅行態度；感受大規模娛樂空間的環境設計","超級任天堂世界入場需整理券（免費抽）或特定 Express Pass；早入場可搶先取整理券"
"21:00","21:26","大阪此花→心齋橋","交通","Universal City 站 → 美國村周邊","搭 JR 夢咲線 + 大阪環狀線返回心齋橋附近的美國村晚餐","JR 夢咲線 + Osaka Metro","Universal City 搭 JR 夢咲線至西九条，轉 JR 環狀線或 Osaka Metro 至心齋橋；Google Maps: Universal City Station to Shinsaibashi Osaka","約26分鐘","抵達後立即前往晚餐","ICOCA","大眾運輸返回","從大型樂園返回城市，感受一日娛樂與城市日常的對比","晚餐前確認海鮮屋台おくまん是否需要等候"
"21:26","22:26","大阪美國村","晚餐","海鮮屋台おくまん アメ村店","享用大阪居酒屋風格海鮮料理，犒賞全天 USJ 的疲勞","步行","美國村周邊；Google Maps: Okumon Seafood Tavern Amemura Osaka","約0分鐘","推薦各式海鮮串燒、生魚片、炸物；可搭配大阪在地生啤","無","選擇在地食材料理，支持大阪在地餐廳","感受大阪庶民飲食文化，海鮮料理體現大阪靠海的在地食材精神","居酒屋多為現金，出發前確認；深夜可能有等候"
"22:26","22:28","大阪心齋橋","交通","海鮮屋台 → 心齋橋維亞酒店","步行即達","步行","Google Maps: Okumon Amemura to Via Inn Shinsaibashi","約2分鐘","無","無","步行","結束 USJ 全天行程，步行返回休息","USJ 後體力消耗大，回飯店直接休息"
"22:28","23:28","大阪心齋橋","住宿","心齋橋維亞酒店－JR 西日本集團","返回飯店盥洗休息，確認明日難波一日行程","步行","飯店內","約0分鐘","無","無","無","在城市飯店中好好休息，整理一日體驗","明日行程較輕鬆，可稍晚起床"
